recommender,prolificPID,recID,movieTitle,shouldWatch,order,sentence,classification
gpt-3.5-turbo,61254c5a6facc8ed023a64de,1,The Silence of the Lambs,TRUE,0,The Silence of the Lambs is a must-watch movie for anyone who loves psychological thrillers.,Ev
gpt-3.5-turbo,61254c5a6facc8ed023a64de,1,The Silence of the Lambs,TRUE,1,"The movie is a masterpiece in terms of storytelling, acting, and direction.",Ev
gpt-3.5-turbo,61254c5a6facc8ed023a64de,1,The Silence of the Lambs,TRUE,2,"It keeps you on the edge of your seat from start to finish, with its gripping plot and unforgettable characters.",Ev
gpt-3.5-turbo,61254c5a6facc8ed023a64de,1,The Silence of the Lambs,TRUE,3,"The performances of Jodie Foster and Anthony Hopkins are outstanding, and the movie's themes of power, manipulation, and obsession are explored in a way that will leave you thinking long after the credits roll.",Ev
gpt-3.5-turbo,61254c5a6facc8ed023a64de,1,The Silence of the Lambs,TRUE,4,"If you're a fan of the genre, or just looking for a great movie to watch, The Silence of the Lambs is a must-see.",Ev
random-imdb,61254c5a6facc8ed023a64de,2,The Lion King,TRUE,0,The Lion King is a timeless classic that has captured the hearts of audiences for generations.,NA
random-imdb,61254c5a6facc8ed023a64de,2,The Lion King,TRUE,1,"This animated masterpiece tells the story of Simba, a young lion who must overcome adversity and reclaim his rightful place as king of the Pride Lands.",NA
random-imdb,61254c5a6facc8ed023a64de,2,The Lion King,TRUE,2,"With stunning animation, unforgettable music, and a powerful message about the importance of family and responsibility, The Lion King is a must-see for anyone who loves great storytelling.",Ev
random-imdb,61254c5a6facc8ed023a64de,2,The Lion King,TRUE,3,"Whether you're a fan of animation, drama, or just great movies in general, The Lion King is a film that you won't want to miss.",Ev
random-imdb,61254c5a6facc8ed023a64de,3,Angels with Dirty Faces,TRUE,0,Angels with Dirty Faces is a classic crime drama that tells the story of two childhood friends who grow up to become very different men.,NA
random-imdb,61254c5a6facc8ed023a64de,3,Angels with Dirty Faces,TRUE,1,"One becomes a priest, while the other becomes a notorious gangster.",NA
random-imdb,61254c5a6facc8ed023a64de,3,Angels with Dirty Faces,TRUE,2,"The movie explores themes of loyalty, friendship, and the consequences of one's actions.",NA
random-imdb,61254c5a6facc8ed023a64de,3,Angels with Dirty Faces,TRUE,3,"If you enjoyed The Godfather, you may appreciate the complex relationships between the characters in Angels with Dirty Faces.",Comp
random-imdb,61254c5a6facc8ed023a64de,3,Angels with Dirty Faces,TRUE,4,"The Shawshank Redemption also deals with themes of redemption and the consequences of one's actions, which are also present in Angels with Dirty Faces.",Comp
random-imdb,61254c5a6facc8ed023a64de,3,Angels with Dirty Faces,TRUE,5,"Catch Me If You Can is a crime drama that explores the life of a con artist, which may appeal to fans of the gangster character in Angels with Dirty Faces.",Comp
random-imdb,61254c5a6facc8ed023a64de,3,Angels with Dirty Faces,TRUE,6,"If you disliked Pulp Fiction, 2001: A Space Odyssey, and Zardoz, you may appreciate the more straightforward storytelling and classic Hollywood style of Angels with Dirty Faces.",Op
gpt-3.5-turbo,61254c5a6facc8ed023a64de,4,The Matrix,FALSE,0,Someone with these movie preferences may not enjoy watching The Matrix because it shares some similarities with the movies they disliked.,Sim
gpt-3.5-turbo,61254c5a6facc8ed023a64de,4,The Matrix,FALSE,1,"Pulp Fiction and The Matrix are both non-linear in their storytelling, which may not be appealing to someone who dislikes the former.",Sim
gpt-3.5-turbo,61254c5a6facc8ed023a64de,4,The Matrix,FALSE,2,"2001: A Space Odyssey and Zardoz are both science fiction movies that are known for their abstract and surreal elements, which may not be enjoyable for someone who dislikes those types of movies.",Sim
gpt-3.5-turbo,61254c5a6facc8ed023a64de,4,The Matrix,FALSE,3,"Additionally, The Matrix has some violent scenes, which may not be appealing to someone who prefers more character-driven movies like The Godfather or The Shawshank Redemption.",Comp
gpt-3.5-turbo,61254c5a6facc8ed023a64de,5,The Room,FALSE,0,"You should not watch the movie ""The Room"" because it is widely considered to be one of the worst movies ever made.",Po
gpt-3.5-turbo,61254c5a6facc8ed023a64de,5,The Room,FALSE,1,"The acting is terrible, the plot is nonsensical, and the production values are extremely low.",Ev
gpt-3.5-turbo,61254c5a6facc8ed023a64de,5,The Room,FALSE,2,"While some people enjoy watching bad movies for their entertainment value, ""The Room"" is so bad that it may not even be enjoyable in that way.",Ev
gpt-3.5-turbo,61254c5a6facc8ed023a64de,5,The Room,FALSE,3,Save yourself the time and watch something else instead.,Pra
gpt-3.5-turbo,61669e4582549043d66bdd78,0,Contagion,TRUE,0,"Contagion is a movie that someone with these preferences should watch because it shares similarities with Outbreak, a favorite movie.",Sim
gpt-3.5-turbo,61669e4582549043d66bdd78,0,Contagion,TRUE,1,Both movies deal with the outbreak of a deadly virus and the race to find a cure.,Sim
gpt-3.5-turbo,61669e4582549043d66bdd78,0,Contagion,TRUE,2,"Additionally, Contagion has a strong cast, including Matt Damon and Kate Winslet, and a well-written script that keeps the audience engaged.",NA
gpt-3.5-turbo,61669e4582549043d66bdd78,0,Contagion,TRUE,3,"While it may not have the action-packed scenes of John Wick or the courtroom drama of A Time to Kill, Contagion offers a thought-provoking and timely story that is relevant to our current world situation.",Comp
gpt-3.5-turbo,61669e4582549043d66bdd78,0,Contagion,TRUE,4,"As for the disliked movies, Contagion is vastly different from American Pie and The Matrix Reloaded, and it offers a more serious and realistic take on a global crisis.",Comp
gpt-3.5-turbo,61669e4582549043d66bdd78,1,A Time to Kill,TRUE,0,"A Time to Kill is a gripping legal drama that explores themes of race, justice, and morality.",NA
gpt-3.5-turbo,61669e4582549043d66bdd78,1,A Time to Kill,TRUE,1,The movie tells the story of a young lawyer who defends a black man accused of murdering two white men who raped his daughter.,NA
gpt-3.5-turbo,61669e4582549043d66bdd78,1,A Time to Kill,TRUE,2,"The film is emotionally charged and features powerful performances from its cast, including Samuel L. Jackson, Matthew McConaughey, and Sandra Bullock.",NA
gpt-3.5-turbo,61669e4582549043d66bdd78,1,A Time to Kill,TRUE,3,A Time to Kill is a thought-provoking and intense film that will leave you thinking about its themes long after the credits roll.,NA
gpt-3.5-turbo,61669e4582549043d66bdd78,1,A Time to Kill,TRUE,4,"If you enjoy legal dramas or movies that tackle complex social issues, A Time to Kill is definitely worth watching.",Ev
random-imdb,61669e4582549043d66bdd78,2,Darkest Hour,TRUE,0,"If you are a fan of historical dramas, then you should definitely watch ""Darkest Hour"".",Ev
random-imdb,61669e4582549043d66bdd78,2,Darkest Hour,TRUE,1,This movie tells the story of Winston Churchill's early days as Prime Minister of the United Kingdom during World War II.,NA
random-imdb,61669e4582549043d66bdd78,2,Darkest Hour,TRUE,2,Gary Oldman's performance as Churchill is outstanding and earned him an Academy Award for Best Actor.,Ev
random-imdb,61669e4582549043d66bdd78,2,Darkest Hour,TRUE,3,The film also features stunning cinematography and a gripping score.,Ev
random-imdb,61669e4582549043d66bdd78,2,Darkest Hour,TRUE,4,"""Darkest Hour"" is a powerful and inspiring portrayal of a pivotal moment in history and is a must-see for anyone interested in politics or World War II.",Ev
gpt-3.5-turbo,6120b4fca2fedeb88787374c,1,The Martian,TRUE,0,"If you're a fan of science fiction and survival stories, then you should definitely watch ""The Martian"".",Ev
gpt-3.5-turbo,6120b4fca2fedeb88787374c,1,The Martian,TRUE,1,This movie tells the story of an astronaut who is stranded on Mars and must use his knowledge and skills to survive until he can be rescued.,NA
gpt-3.5-turbo,6120b4fca2fedeb88787374c,1,The Martian,TRUE,2,The film is visually stunning and features a great performance by Matt Damon as the lead character.,Ev
gpt-3.5-turbo,6120b4fca2fedeb88787374c,1,The Martian,TRUE,3,It's a thrilling and suspenseful ride that will keep you on the edge of your seat until the very end.,Ev
gpt-3.5-turbo,6120b4fca2fedeb88787374c,1,The Martian,TRUE,4,"Plus, it's a great reminder of the power of human ingenuity and the importance of never giving up in the face of adversity.",Ev
random-imdb,6120b4fca2fedeb88787374c,2,Talladega Nights: The Ballad of Ricky Bobby,TRUE,0,"If you're a fan of Will Ferrell's brand of humor, you'll love Talladega Nights: The Ballad of Ricky Bobby.",Ev
random-imdb,6120b4fca2fedeb88787374c,2,Talladega Nights: The Ballad of Ricky Bobby,TRUE,1,"This movie is a hilarious satire of the world of NASCAR racing, with Ferrell playing the titular character, a cocky and overconfident driver who must learn to overcome his own ego and work with his teammate to win races.",Ev
random-imdb,6120b4fca2fedeb88787374c,2,Talladega Nights: The Ballad of Ricky Bobby,TRUE,2,"The film is full of absurd humor, over-the-top characters, and quotable one-liners that will have you laughing out loud.",Ev
random-imdb,6120b4fca2fedeb88787374c,2,Talladega Nights: The Ballad of Ricky Bobby,TRUE,3,"Plus, the supporting cast, including John C. Reilly and Sacha Baron Cohen, is fantastic.",NA
random-imdb,6120b4fca2fedeb88787374c,2,Talladega Nights: The Ballad of Ricky Bobby,TRUE,4,"If you're in the mood for a silly, irreverent comedy, Talladega Nights is definitely worth a watch.",Ev
gpt-3.5-turbo,61669e4582549043d66bdd78,4,Twilight,FALSE,0,Twilight is a movie that may not be suitable for everyone.,NA
gpt-3.5-turbo,61669e4582549043d66bdd78,4,Twilight,FALSE,1,"The movie is known for its cheesy dialogue, poor acting, and lack of plot development.",Ev
gpt-3.5-turbo,61669e4582549043d66bdd78,4,Twilight,FALSE,2,"The story revolves around a teenage girl who falls in love with a vampire, which may not appeal to everyone's taste.",Ev
gpt-3.5-turbo,61669e4582549043d66bdd78,4,Twilight,FALSE,3,"Additionally, the movie has been criticized for promoting unhealthy relationships and toxic masculinity.",Ev
gpt-3.5-turbo,61669e4582549043d66bdd78,4,Twilight,FALSE,4,"Overall, if you are looking for a well-written and well-acted movie, Twilight may not be the best choice for you.",Ev
gpt-3.5-turbo,61669e4582549043d66bdd78,5,The Notebook,FALSE,0,"Someone with these movie preferences may not enjoy watching The Notebook because it is a romantic drama, which is a genre that is not represented in their favorite movies.",Cr
gpt-3.5-turbo,61669e4582549043d66bdd78,5,The Notebook,FALSE,1,"Additionally, The Notebook is a slow-paced movie that focuses on character development and relationships, which may not be appealing to someone who enjoys action-packed movies like John Wick or Outbreak.",Comp
gpt-3.5-turbo,61669e4582549043d66bdd78,5,The Notebook,FALSE,2,"Finally, The Notebook has a sentimental and emotional tone, which may not resonate with someone who disliked movies like Faith Like Potatoes or A Time to Kill, which have a more serious and dramatic tone.",Comp
gpt-3.5-turbo,60dc9556508486e19fc42546,0,Ocean's Eleven,TRUE,0,Ocean's Eleven is a great movie for someone who enjoys heist movies with a touch of humor.,Ev
gpt-3.5-turbo,60dc9556508486e19fc42546,0,Ocean's Eleven,TRUE,1,"The movie features a star-studded cast, including George Clooney, Brad Pitt, and Matt Damon, who plan to rob three Las Vegas casinos simultaneously.",NA
gpt-3.5-turbo,60dc9556508486e19fc42546,0,Ocean's Eleven,TRUE,2,"The Italian Job, one of the favorite movies mentioned, is also a heist movie, so there is a good chance that the person will enjoy Ocean's Eleven.",Sim
gpt-3.5-turbo,60dc9556508486e19fc42546,0,Ocean's Eleven,TRUE,3,"Additionally, The Big Short, another favorite movie, has a similar fast-paced and witty dialogue that can be found in Ocean's Eleven.",Sim
gpt-3.5-turbo,60dc9556508486e19fc42546,0,Ocean's Eleven,TRUE,4,"Overall, if the person is looking for an entertaining and thrilling movie with a great cast and a clever plot, Ocean's Eleven is definitely worth watching.",Ev
random-imdb,60dc9556508486e19fc42546,1,"Monsters, Inc.",TRUE,0,"Monsters, Inc. is a heartwarming and entertaining animated movie that is perfect for all ages.",NA
random-imdb,60dc9556508486e19fc42546,1,"Monsters, Inc.",TRUE,1,"The film follows the story of two monsters, Sulley and Mike, who work at a company that collects children's screams to power their city.",NA
random-imdb,60dc9556508486e19fc42546,1,"Monsters, Inc.",TRUE,2,"The movie is filled with humor, adventure, and a touching message about the power of friendship and the importance of overcoming fear.",Ev
random-imdb,60dc9556508486e19fc42546,1,"Monsters, Inc.",TRUE,3,"The animation is top-notch, and the voice acting is superb.",NA
random-imdb,60dc9556508486e19fc42546,1,"Monsters, Inc.",TRUE,4,"If you're looking for a fun and heartwarming movie to watch with your family or friends, Monsters, Inc. is definitely worth checking out.",Ev
gpt-3.5-turbo,60dc9556508486e19fc42546,2,The Dark Knight,TRUE,0,"The Dark Knight is a must-watch movie for anyone who loves action, suspense, and drama.",Ev
gpt-3.5-turbo,60dc9556508486e19fc42546,2,The Dark Knight,TRUE,1,"The film is a masterpiece in storytelling, with a gripping plot that keeps you on the edge of your seat from start to finish.",Ev
gpt-3.5-turbo,60dc9556508486e19fc42546,2,The Dark Knight,TRUE,2,"The performances by the cast, especially Heath Ledger's iconic portrayal of the Joker, are outstanding and unforgettable.",Ev
gpt-3.5-turbo,60dc9556508486e19fc42546,2,The Dark Knight,TRUE,3,"The movie also explores complex themes such as morality, justice, and the nature of evil.",Ev
gpt-3.5-turbo,60dc9556508486e19fc42546,2,The Dark Knight,TRUE,4,"Overall, The Dark Knight is a cinematic experience that will leave you breathless and thinking long after the credits roll.",Ev
random-imdb,60dc9556508486e19fc42546,3,Dunkirk,TRUE,0,Dunkirk is a war movie that tells the story of the evacuation of Allied soldiers from the beaches of Dunkirk during World War II.,NA
random-imdb,60dc9556508486e19fc42546,3,Dunkirk,TRUE,1,"If you enjoy action-packed movies with intense and suspenseful scenes, Dunkirk is a great choice for you.",Ev
random-imdb,60dc9556508486e19fc42546,3,Dunkirk,TRUE,2,"The Italian Job and The Avengers are both action movies with heist and superhero themes, respectively, which share similarities with Dunkirk's war theme.",Sim
random-imdb,60dc9556508486e19fc42546,3,Dunkirk,TRUE,3,"The Big Short is a drama that also features intense and suspenseful scenes, which can be found in Dunkirk as well.",Sim
random-imdb,60dc9556508486e19fc42546,3,Dunkirk,TRUE,4,"On the other hand, if you disliked Training Day, I Am Legend, and Bright, which are all movies with darker themes, you may appreciate Dunkirk's focus on heroism and survival.",Comp
random-imdb,60dc9556508486e19fc42546,3,Dunkirk,TRUE,5,"Overall, Dunkirk is a well-crafted movie that offers a unique perspective on a historical event and is worth watching for anyone who enjoys action and suspense.",Ev
gpt-3.5-turbo,60dc9556508486e19fc42546,4,The Last Airbender,FALSE,0,Someone with these movie preferences should not watch The Last Airbender because it has received overwhelmingly negative reviews from both critics and audiences.,Pra
gpt-3.5-turbo,60dc9556508486e19fc42546,4,The Last Airbender,FALSE,1,"It has been criticized for its poor acting, weak script, and lack of faithfulness to the source material.",NA
gpt-3.5-turbo,60dc9556508486e19fc42546,4,The Last Airbender,FALSE,2,"Additionally, the director M. Night Shyamalan has a history of making disappointing films.",Au
gpt-3.5-turbo,60dc9556508486e19fc42546,4,The Last Airbender,FALSE,3,"Given the person's dislike for movies such as Training Day, I Am Legend, and Bright, it is unlikely that they would enjoy The Last Airbender.",Cr
gpt-3.5-turbo,60dc9556508486e19fc42546,4,The Last Airbender,FALSE,4,"It is better for them to choose a movie that aligns more with their favorite movies such as The Italian Job, The Avengers, or The Big Short.",Comp
gpt-3.5-turbo,60dc9556508486e19fc42546,5,The Room,FALSE,0,"You should not watch the movie ""The Room"" because it is widely considered to be one of the worst movies ever made.",Po
gpt-3.5-turbo,60dc9556508486e19fc42546,5,The Room,FALSE,1,"The acting is terrible, the plot is nonsensical, and the production values are extremely low.",Ev
gpt-3.5-turbo,60dc9556508486e19fc42546,5,The Room,FALSE,2,"While some people enjoy watching bad movies for their entertainment value, ""The Room"" is so bad that it may not even be enjoyable in that way.",Ev
gpt-3.5-turbo,60dc9556508486e19fc42546,5,The Room,FALSE,3,Save yourself the time and watch something else instead.,Pra
gpt-3.5-turbo,6120b4fca2fedeb88787374c,0,The Imitation Game,TRUE,0,"The Imitation Game is a movie that someone with these preferences should watch because it has a mix of drama, action, and suspense.",Cr
gpt-3.5-turbo,6120b4fca2fedeb88787374c,0,The Imitation Game,TRUE,1,"The movie is based on the true story of Alan Turing, a brilliant mathematician who helped crack the Nazi's Enigma code during World War II.",NA
gpt-3.5-turbo,6120b4fca2fedeb88787374c,0,The Imitation Game,TRUE,2,"The movie has a strong cast, including Benedict Cumberbatch and Keira Knightley, and has received critical acclaim for its storytelling and performances.",Au
gpt-3.5-turbo,6120b4fca2fedeb88787374c,0,The Imitation Game,TRUE,3,"If you enjoyed the historical drama of The Help and the emotional depth of Me Before You, you may appreciate the complex characters and themes in The Imitation Game.",Comp
gpt-3.5-turbo,6120b4fca2fedeb88787374c,0,The Imitation Game,TRUE,4,"Additionally, if you were disappointed by the action in Fast & Furious Presents: Hobbs & Shaw, The Imitation Game offers a different type of excitement through its high-stakes code-breaking scenes.",Comp
gpt-3.5-turbo,6120b4fca2fedeb88787374c,0,The Imitation Game,TRUE,5,"Overall, The Imitation Game is a well-crafted movie that offers something for a variety of movie preferences.",Ev
gpt-3.5-turbo,60fb1b68ff87fb94e0e721f6,4,The Last Airbender,FALSE,0,"You should not watch the movie ""The Last Airbender"" because it is widely considered to be a poorly made adaptation of the beloved animated series.",Po
gpt-3.5-turbo,60fb1b68ff87fb94e0e721f6,4,The Last Airbender,FALSE,1,"The movie fails to capture the essence of the characters and the world they inhabit, and the acting and special effects are lackluster.",Ev
gpt-3.5-turbo,60fb1b68ff87fb94e0e721f6,4,The Last Airbender,FALSE,2,Fans of the original series were disappointed by the changes made to the story and the lack of depth in the characters.,Ev
gpt-3.5-turbo,60fb1b68ff87fb94e0e721f6,4,The Last Airbender,FALSE,3,"Overall, ""The Last Airbender"" is a disappointing and forgettable film that is not worth your time.",Ev
random-imdb,6120b4fca2fedeb88787374c,3,The Thin Red Line,TRUE,0,The Thin Red Line is a war movie that tells the story of a group of soldiers during the Battle of Guadalcanal in World War II.,NA
random-imdb,6120b4fca2fedeb88787374c,3,The Thin Red Line,TRUE,1,"Although it may not seem like an obvious choice for someone who enjoys dramas and dislikes action movies, The Thin Red Line is a beautifully shot and emotionally powerful film that explores the human condition in times of war.",Ev
random-imdb,6120b4fca2fedeb88787374c,3,The Thin Red Line,TRUE,2,"The movie features a talented cast, including Sean Penn, Jim Caviezel, and Nick Nolte, and is directed by Terrence Malick, who is known for his visually stunning films.",NA
random-imdb,6120b4fca2fedeb88787374c,3,The Thin Red Line,TRUE,3,"If you are looking for a thought-provoking and visually stunning movie that explores the complexities of war and the human experience, The Thin Red Line is definitely worth watching.",Ev
gpt-3.5-turbo,6120b4fca2fedeb88787374c,4,Transformers: Age of Extinction,FALSE,0,I would not recommend watching Transformers: Age of Extinction because it received negative reviews from both critics and audiences.,Au
gpt-3.5-turbo,6120b4fca2fedeb88787374c,4,Transformers: Age of Extinction,FALSE,1,"The movie is known for its convoluted plot, excessive runtime, and lack of character development.",NA
gpt-3.5-turbo,6120b4fca2fedeb88787374c,4,Transformers: Age of Extinction,FALSE,2,"Additionally, the film relies heavily on special effects and action sequences, which can become tiresome and repetitive.",NA
gpt-3.5-turbo,6120b4fca2fedeb88787374c,4,Transformers: Age of Extinction,FALSE,3,"Overall, there are better options for action and sci-fi movies that offer more engaging storytelling and character development.",Comp
gpt-3.5-turbo,6120b4fca2fedeb88787374c,5,The Last Airbender,FALSE,0,"Someone with these movie preferences should not watch the movie ""The Last Airbender"" because it has received overwhelmingly negative reviews from both critics and audiences.",Po
gpt-3.5-turbo,6120b4fca2fedeb88787374c,5,The Last Airbender,FALSE,1,"Additionally, it has been criticized for its poor acting, weak storyline, and lack of faithfulness to the source material.",Po
gpt-3.5-turbo,6120b4fca2fedeb88787374c,5,The Last Airbender,FALSE,2,"Given that the person dislikes movies such as ""Jumping the Broom"" and ""The King's Case Note,"" which have also received negative reviews, it is likely that they would not enjoy ""The Last Airbender"" either.",Sim
gpt-3.5-turbo,6120b4fca2fedeb88787374c,5,The Last Airbender,FALSE,3,"Instead, they may enjoy movies with strong storylines and well-developed characters, such as ""The Help"" and ""Me Before You,"" or action-packed thrillers like ""Taken 2.""",Comp
gpt-3.5-turbo,6139d11e12004b36e50206d1,0,La La Land,TRUE,0,La La Land is a musical movie that tells the story of a jazz pianist and an aspiring actress who fall in love while pursuing their dreams in Los Angeles.,NA
gpt-3.5-turbo,6139d11e12004b36e50206d1,0,La La Land,TRUE,1,"If you enjoyed Dreamgirls, which is also a musical drama, you may appreciate the music and performances in La La Land.",Sim
gpt-3.5-turbo,6139d11e12004b36e50206d1,0,La La Land,TRUE,2,"Additionally, if you liked Avengers: Endgame, which is an epic and emotional movie, you may appreciate the grandeur and emotional depth of La La Land.",Sim
gpt-3.5-turbo,6139d11e12004b36e50206d1,0,La La Land,TRUE,3,"On the other hand, if you disliked Avatar and Avatar: The Last Airbender - The Legend So Far, which are both fantasy movies, you may appreciate the grounded and realistic setting of La La Land.",Sim
gpt-3.5-turbo,6139d11e12004b36e50206d1,0,La La Land,TRUE,4,"Overall, La La Land is a visually stunning and emotionally engaging movie that may appeal to your taste in music, drama, and epic storytelling.",Ev
gpt-3.5-turbo,6139d11e12004b36e50206d1,1,The Hunger Games,TRUE,0,"The Hunger Games is a thrilling and thought-provoking movie that explores themes of survival, sacrifice, and rebellion.",NA
gpt-3.5-turbo,6139d11e12004b36e50206d1,1,The Hunger Games,TRUE,1,"Set in a dystopian future where children are forced to fight to the death in a televised competition, the movie follows the journey of Katniss Everdeen as she navigates the treacherous world of the Hunger Games.",NA
gpt-3.5-turbo,6139d11e12004b36e50206d1,1,The Hunger Games,TRUE,2,"With a talented cast, stunning visuals, and a gripping storyline, The Hunger Games is a must-watch for anyone who enjoys action, adventure, and dystopian fiction.",Ev
gpt-3.5-turbo,6139d11e12004b36e50206d1,1,The Hunger Games,TRUE,3,"Whether you're a fan of the book series or just looking for a thrilling movie to watch, The Hunger Games is sure to keep you on the edge of your seat from start to finish.",Ev
random-imdb,6139d11e12004b36e50206d1,2,Unforgiven,TRUE,0,"If you're a fan of westerns, then Unforgiven is a must-watch.",Ev
random-imdb,6139d11e12004b36e50206d1,2,Unforgiven,TRUE,1,This movie is a masterpiece that explores the dark side of the Wild West and the consequences of violence.,Ev
random-imdb,6139d11e12004b36e50206d1,2,Unforgiven,TRUE,2,The story follows an aging gunslinger who takes one last job to earn some money.,NA
random-imdb,6139d11e12004b36e50206d1,2,Unforgiven,TRUE,3,"However, things don't go as planned, and he finds himself facing his past and the demons that come with it.",NA
random-imdb,6139d11e12004b36e50206d1,2,Unforgiven,TRUE,4,"Unforgiven is a gritty and realistic portrayal of the Old West, with outstanding performances from Clint Eastwood, Gene Hackman, and Morgan Freeman.",Ev
random-imdb,6139d11e12004b36e50206d1,2,Unforgiven,TRUE,5,It's a movie that will keep you on the edge of your seat until the very end.,Ev
random-imdb,6139d11e12004b36e50206d1,3,Moana,TRUE,0,Moana is a great movie for someone who enjoys movies with strong female leads and epic adventures.,Ev
random-imdb,6139d11e12004b36e50206d1,3,Moana,TRUE,1,The movie tells the story of a young girl who sets out on a journey to save her people and discovers her own identity along the way.,NA
random-imdb,6139d11e12004b36e50206d1,3,Moana,TRUE,2,"The themes of self-discovery and empowerment are similar to those found in Divergent, while the epic adventure aspect is similar to Avengers: Endgame.",Sim
random-imdb,6139d11e12004b36e50206d1,3,Moana,TRUE,3,"Additionally, Moana has a unique and vibrant setting inspired by Polynesian culture, which may be a refreshing change of pace from the sci-fi and superhero genres.",Ev
random-imdb,6139d11e12004b36e50206d1,3,Moana,TRUE,4,"Overall, Moana is a great choice for someone who enjoys movies with strong themes of self-discovery and empowerment, epic adventures, and unique settings.",Ev
