recommender,prolificPID,recID,movieTitle,shouldWatch,order,sentence,classification
gpt-3.5-turbo,6413b18b8202c4f1302e0561,4,The Emoji Movie,FALSE,1,"The movie has been criticized for its lack of originality, poor writing, and reliance on cheap humor.",NA
gpt-3.5-turbo,6413b18b8202c4f1302e0561,4,The Emoji Movie,FALSE,2,"Given the person's preferences for movies with complex storylines and well-developed characters, The Emoji Movie is unlikely to meet their expectations and may be a disappointment.",Cr
gpt-3.5-turbo,6413b18b8202c4f1302e0561,4,The Emoji Movie,FALSE,3,"It is better to recommend movies that align with their preferences, such as Inception, The Shawshank Redemption, or The Godfather.",Comp
gpt-3.5-turbo,6413b18b8202c4f1302e0561,5,The Last Airbender,FALSE,0,"You should not watch the movie ""The Last Airbender"" because it is widely considered to be a poorly made adaptation of the beloved animated series.",Po
gpt-3.5-turbo,6413b18b8202c4f1302e0561,5,The Last Airbender,FALSE,1,"The movie fails to capture the essence of the characters and the world they inhabit, and the acting and special effects are lackluster.",Ev
gpt-3.5-turbo,6413b18b8202c4f1302e0561,5,The Last Airbender,FALSE,2,Fans of the original series were disappointed by the changes made to the story and the lack of depth in the characters.,Ev
gpt-3.5-turbo,6413b18b8202c4f1302e0561,5,The Last Airbender,FALSE,3,"Overall, ""The Last Airbender"" is a disappointing and forgettable film that does not do justice to the source material.",Ev
gpt-3.5-turbo,60a99bad6164fb6e0e10aa16,0,The Help,TRUE,0,The Help is a movie that someone with these preferences should watch because it shares similarities with some of their favorite movies.,Sim
gpt-3.5-turbo,60a99bad6164fb6e0e10aa16,0,The Help,TRUE,1,"Like The Secret Life of Bees, it is a heartwarming story about strong women overcoming adversity.",An
gpt-3.5-turbo,60a99bad6164fb6e0e10aa16,0,The Help,TRUE,2,"Additionally, like In-Lawfully Yours, it deals with themes of race and social justice.",An
gpt-3.5-turbo,60a99bad6164fb6e0e10aa16,0,The Help,TRUE,3,"While The Help may not be similar to the movies they disliked, it is still worth watching because it has received critical acclaim and has a strong cast, including Emma Stone and Viola Davis.",Ev
gpt-3.5-turbo,60a99bad6164fb6e0e10aa16,0,The Help,TRUE,4,"Overall, The Help is a movie that has the potential to appeal to someone who enjoys uplifting stories about women and social justice.",Ev
random-imdb,60a99bad6164fb6e0e10aa16,1,Cinderella Man,TRUE,0,Cinderella Man is a must-watch movie for sports and drama enthusiasts.,Ev
random-imdb,60a99bad6164fb6e0e10aa16,1,Cinderella Man,TRUE,1,"The movie is based on the true story of James J. Braddock, a boxer who fought his way back to the top during the Great Depression.",NA
random-imdb,60a99bad6164fb6e0e10aa16,1,Cinderella Man,TRUE,2,The film is a powerful portrayal of the human spirit and the determination to overcome adversity.,Ev
random-imdb,60a99bad6164fb6e0e10aa16,1,Cinderella Man,TRUE,3,"The performances by Russell Crowe and Paul Giamatti are outstanding, and the direction by Ron Howard is masterful.",Ev
random-imdb,60a99bad6164fb6e0e10aa16,1,Cinderella Man,TRUE,4,The movie is a heartwarming and inspiring story that will leave you feeling uplifted and motivated.,Ev
random-imdb,60a99bad6164fb6e0e10aa16,1,Cinderella Man,TRUE,5,"If you enjoy sports movies with a strong emotional core, Cinderella Man is definitely worth watching.",Ev
random-imdb,60a99bad6164fb6e0e10aa16,2,Singin' in the Rain,TRUE,0,Singin' in the Rain is a classic musical comedy that tells the story of a Hollywood star who falls in love with a young actress during the transition from silent films to talkies.,NA
random-imdb,60a99bad6164fb6e0e10aa16,2,Singin' in the Rain,TRUE,1,"Although it may seem like a departure from the movies you listed as your favorites and dislikes, Singin' in the Rain is a timeless film that has something for everyone.",Ev
random-imdb,60a99bad6164fb6e0e10aa16,2,Singin' in the Rain,TRUE,2,"If you enjoy romantic comedies, you'll appreciate the charming love story at the heart of the film.",Ev
random-imdb,60a99bad6164fb6e0e10aa16,2,Singin' in the Rain,TRUE,3,"If you appreciate good music and dance, you'll love the iconic song and dance numbers, including the famous title song.",Ev
random-imdb,60a99bad6164fb6e0e10aa16,2,Singin' in the Rain,TRUE,4,"And if you're a fan of classic Hollywood cinema, you'll appreciate the film's satirical take on the movie industry.",Ev
random-imdb,60a99bad6164fb6e0e10aa16,2,Singin' in the Rain,TRUE,5,"Singin' in the Rain is a beloved classic that has stood the test of time, and it's definitely worth a watch for anyone who loves movies.",Ev
gpt-3.5-turbo,60a99bad6164fb6e0e10aa16,3,Little Women,TRUE,0,Little Women is a heartwarming and timeless story that explores the lives of four sisters as they navigate their way through the challenges of growing up in the late 1800s.,NA
gpt-3.5-turbo,60a99bad6164fb6e0e10aa16,3,Little Women,TRUE,1,"The film is beautifully shot and features a talented cast, including Saoirse Ronan, Emma Watson, and Timothe Chalamet.",NA
gpt-3.5-turbo,60a99bad6164fb6e0e10aa16,3,Little Women,TRUE,2,"It's a story about family, love, and the pursuit of one's dreams, and it's sure to leave you feeling inspired and uplifted.",Ev
gpt-3.5-turbo,60a99bad6164fb6e0e10aa16,3,Little Women,TRUE,3,"Whether you're a fan of the book or just looking for a well-crafted and engaging film, Little Women is definitely worth watching.",Ev
gpt-3.5-turbo,60a99bad6164fb6e0e10aa16,4,The Human Centipede,FALSE,0,"Someone with these movie preferences should not watch the movie ""The Human Centipede"" because it is a horror movie that involves graphic and disturbing scenes.",Pra
gpt-3.5-turbo,60a99bad6164fb6e0e10aa16,4,The Human Centipede,FALSE,1,"The person's favorite movies are all dramas or comedies, and the movies they disliked are also comedies.",NA
gpt-3.5-turbo,60a99bad6164fb6e0e10aa16,4,The Human Centipede,FALSE,2,"""The Human Centipede"" is not only a horror movie, but it is also known for its extreme and grotesque content, which may not be suitable for someone who dislikes movies with a lot of violence or gore.",Pra
gpt-3.5-turbo,60a99bad6164fb6e0e10aa16,4,The Human Centipede,FALSE,3,"Therefore, it is unlikely that someone with these movie preferences would enjoy watching ""The Human Centipede"".",Pra
gpt-3.5-turbo,60a99bad6164fb6e0e10aa16,5,The Emoji Movie,FALSE,0,I would not recommend watching The Emoji Movie because it received overwhelmingly negative reviews from both critics and audiences.,Ev
gpt-3.5-turbo,60a99bad6164fb6e0e10aa16,5,The Emoji Movie,FALSE,1,"The movie has been criticized for its lack of originality, poor writing, and uninteresting characters.",NA
gpt-3.5-turbo,60a99bad6164fb6e0e10aa16,5,The Emoji Movie,FALSE,2,"Additionally, the movie's attempt to capitalize on the popularity of emojis feels forced and gimmicky.",Ev
gpt-3.5-turbo,60a99bad6164fb6e0e10aa16,5,The Emoji Movie,FALSE,3,"Overall, there are much better movies out there to spend your time watching.",Comp
random-imdb,63c169ece4f637ac694209e5,0,The Cabin in the Woods,TRUE,0,"If you're a fan of horror movies, you should definitely watch ""The Cabin in the Woods"".",Ev
random-imdb,63c169ece4f637ac694209e5,0,The Cabin in the Woods,TRUE,1,"This movie is a clever and self-aware take on the horror genre, with plenty of twists and turns to keep you on the edge of your seat.",Ev
random-imdb,63c169ece4f637ac694209e5,0,The Cabin in the Woods,TRUE,2,It's a fun and entertaining ride that will keep you guessing until the very end.,Ev
random-imdb,63c169ece4f637ac694209e5,0,The Cabin in the Woods,TRUE,3,"Plus, the performances from the cast are top-notch, particularly from Fran Kranz as the stoner character Marty.",Ev
random-imdb,63c169ece4f637ac694209e5,0,The Cabin in the Woods,TRUE,4,"Overall, ""The Cabin in the Woods"" is a must-watch for horror fans who are looking for something fresh and unique.",Ev
gpt-3.5-turbo,63c169ece4f637ac694209e5,1,The Shawshank Redemption,TRUE,0,The Shawshank Redemption is a must-watch movie for anyone who loves a good story.,Ev
gpt-3.5-turbo,63c169ece4f637ac694209e5,1,The Shawshank Redemption,TRUE,1,"It's a classic tale of hope, friendship, and redemption that will leave you feeling inspired.",Ev
gpt-3.5-turbo,63c169ece4f637ac694209e5,1,The Shawshank Redemption,TRUE,2,"If you enjoyed Back to the Future, you'll appreciate the time-traveling aspect of the movie.",Sim
gpt-3.5-turbo,63c169ece4f637ac694209e5,1,The Shawshank Redemption,TRUE,3,Pulp Fiction fans will appreciate the nonlinear storytelling and the complex characters.,Sim
gpt-3.5-turbo,63c169ece4f637ac694209e5,1,The Shawshank Redemption,TRUE,4,Tombstone fans will appreciate the strong male relationships and the themes of loyalty and honor.,Sim
gpt-3.5-turbo,63c169ece4f637ac694209e5,1,The Shawshank Redemption,TRUE,5,"If you disliked Hear My Song, The Sound of Music, and Love Actually, you'll appreciate the darker tone of The Shawshank Redemption and the fact that it doesn't rely on cheesy romantic subplots.",Op
gpt-3.5-turbo,63c169ece4f637ac694209e5,1,The Shawshank Redemption,TRUE,6,"Overall, The Shawshank Redemption is a movie that everyone should watch at least once in their lifetime.",Po
random-imdb,63c169ece4f637ac694209e5,2,Star Wars: Episode VI - Return of the Jedi,TRUE,0,Star Wars: Episode VI - Return of the Jedi is a great movie for someone who enjoys action-packed films with a good versus evil theme.,Ev
random-imdb,63c169ece4f637ac694209e5,2,Star Wars: Episode VI - Return of the Jedi,TRUE,1,"The movie has a strong hero's journey narrative, which is similar to Back to the Future.",Sim
random-imdb,63c169ece4f637ac694209e5,2,Star Wars: Episode VI - Return of the Jedi,TRUE,2,"Additionally, the movie has a lot of memorable characters and witty dialogue, which is similar to Pulp Fiction.",Sim
random-imdb,63c169ece4f637ac694209e5,2,Star Wars: Episode VI - Return of the Jedi,TRUE,3,"Finally, the movie has a lot of exciting action scenes, which is similar to Tombstone.",Sim
random-imdb,63c169ece4f637ac694209e5,2,Star Wars: Episode VI - Return of the Jedi,TRUE,4,"Although the movie is not a musical, it does have a great soundtrack and memorable themes, which may appeal to someone who dislikes musicals like The Sound of Music.",Comp
random-imdb,63c169ece4f637ac694209e5,2,Star Wars: Episode VI - Return of the Jedi,TRUE,5,"Overall, Star Wars: Episode VI - Return of the Jedi is a classic movie that has something for everyone, and it is definitely worth watching for someone with these movie preferences.",Ev
gpt-3.5-turbo,63c169ece4f637ac694209e5,3,The Godfather,TRUE,0,The Godfather is a cinematic masterpiece that has stood the test of time.,NA
gpt-3.5-turbo,63c169ece4f637ac694209e5,3,The Godfather,TRUE,1,"It is a must-watch for anyone who appreciates great storytelling, exceptional acting, and masterful direction.",Ev
gpt-3.5-turbo,63c169ece4f637ac694209e5,3,The Godfather,TRUE,2,"The film explores themes of power, family, loyalty, and betrayal, and does so with a level of nuance and complexity that is rarely seen in cinema.",Ev
gpt-3.5-turbo,63c169ece4f637ac694209e5,3,The Godfather,TRUE,3,"The performances by Marlon Brando, Al Pacino, and the rest of the cast are nothing short of brilliant, and the film's iconic score and cinematography only add to its greatness.",Ev
gpt-3.5-turbo,63c169ece4f637ac694209e5,3,The Godfather,TRUE,4,"If you're a fan of crime dramas, or just great movies in general, The Godfather is a film that you simply cannot miss.",Ev
gpt-3.5-turbo,61645edbf8a9840feeb735b6,3,Goodfellas,TRUE,0,Goodfellas is a classic crime drama that is a must-watch for any movie lover.,Ev
gpt-3.5-turbo,61645edbf8a9840feeb735b6,3,Goodfellas,TRUE,1,"Directed by Martin Scorsese, the film tells the story of Henry Hill, a young man who rises through the ranks of the Mafia.",NA
gpt-3.5-turbo,61645edbf8a9840feeb735b6,3,Goodfellas,TRUE,2,"The movie is known for its incredible performances, especially by Robert De Niro and Joe Pesci, and its realistic portrayal of the criminal underworld.",Ev
gpt-3.5-turbo,61645edbf8a9840feeb735b6,3,Goodfellas,TRUE,3,"The film is also famous for its use of music and editing, which help to create a fast-paced and exciting atmosphere.",Ev
gpt-3.5-turbo,61645edbf8a9840feeb735b6,3,Goodfellas,TRUE,4,"If you enjoy crime movies or are a fan of Scorsese's work, then Goodfellas is definitely worth watching.",Ev
gpt-3.5-turbo,63c169ece4f637ac694209e5,4,The Sound of Music,FALSE,0,"Someone with the movie preferences of Back to the Future, Pulp Fiction, and Tombstone, and who disliked Hear My Song, The Sound of Music, and Love Actually, should not watch The Sound of Music because it is a musical movie with a romantic plot, which may not align with their taste.",Cr
gpt-3.5-turbo,63c169ece4f637ac694209e5,4,The Sound of Music,FALSE,1,The Sound of Music is a classic musical movie that tells the story of a woman who becomes a governess for a widower's seven children and falls in love with him.,NA
gpt-3.5-turbo,63c169ece4f637ac694209e5,4,The Sound of Music,FALSE,2,"It has a lot of singing and dancing scenes, which may not appeal to someone who dislikes musicals.",Cr
gpt-3.5-turbo,63c169ece4f637ac694209e5,4,The Sound of Music,FALSE,3,"Additionally, the romantic plot may not be of interest to someone who prefers action and adventure movies like Back to the Future, Pulp Fiction, and Tombstone.",Cr
gpt-3.5-turbo,63c169ece4f637ac694209e5,5,Love Actually,FALSE,0,Love Actually is not recommended for those who dislike romantic comedies or are looking for a more serious film.,Cr
gpt-3.5-turbo,63c169ece4f637ac694209e5,5,Love Actually,FALSE,1,The movie is a lighthearted and feel-good story that follows multiple characters and their intertwining love lives.,NA
gpt-3.5-turbo,63c169ece4f637ac694209e5,5,Love Actually,FALSE,2,"While it has its moments of humor and heartwarming scenes, it may not be everyone's cup of tea.",Ev
gpt-3.5-turbo,63c169ece4f637ac694209e5,5,Love Actually,FALSE,3,"Additionally, some viewers may find the portrayal of certain relationships to be unrealistic or overly idealized.",Ev
random-imdb,60b65ac40acb3a485dfa7912,0,Kiss Me Deadly,TRUE,0,Kiss Me Deadly is a classic film noir that features a hard-boiled detective and a mysterious woman.,NA
random-imdb,60b65ac40acb3a485dfa7912,0,Kiss Me Deadly,TRUE,1,"Although it may not seem like an obvious choice based on the movies you listed, Kiss Me Deadly shares some similarities with your favorite movies.",Sim
random-imdb,60b65ac40acb3a485dfa7912,0,Kiss Me Deadly,TRUE,2,"Like Fifty Shades of Grey, it has a strong female character who is not afraid to take risks.",Sim
random-imdb,60b65ac40acb3a485dfa7912,0,Kiss Me Deadly,TRUE,3,"Like Think Like a Man, it has a complex plot with unexpected twists and turns.",Sim
random-imdb,60b65ac40acb3a485dfa7912,0,Kiss Me Deadly,TRUE,4,"And like Wrong Turn, it has a dark and gritty atmosphere that keeps you on the edge of your seat.",Sim
random-imdb,60b65ac40acb3a485dfa7912,0,Kiss Me Deadly,TRUE,5,"If you're looking for a classic film that combines suspense, romance, and action, Kiss Me Deadly is definitely worth checking out.",Ev
gpt-3.5-turbo,60b65ac40acb3a485dfa7912,1,The Dark Knight,TRUE,0,"The Dark Knight is a must-watch movie for anyone who loves action, suspense, and drama.",Ev
gpt-3.5-turbo,60b65ac40acb3a485dfa7912,1,The Dark Knight,TRUE,1,"The film is a masterpiece in storytelling, with a gripping plot that keeps you on the edge of your seat from start to finish.",Ev
gpt-3.5-turbo,60b65ac40acb3a485dfa7912,1,The Dark Knight,TRUE,2,"The performances by the cast, especially Heath Ledger's iconic portrayal of the Joker, are outstanding and unforgettable.",Ev
gpt-3.5-turbo,60b65ac40acb3a485dfa7912,1,The Dark Knight,TRUE,3,"The movie also explores complex themes such as morality, justice, and the nature of evil.",Ev
gpt-3.5-turbo,60b65ac40acb3a485dfa7912,1,The Dark Knight,TRUE,4,"Overall, The Dark Knight is a cinematic experience that will leave you breathless and thinking long after the credits roll.",Ev
random-imdb,60b65ac40acb3a485dfa7912,2,The Thin Red Line,TRUE,0,The Thin Red Line is a must-watch for anyone who enjoys war movies that delve into the psychological impact of combat.,Ev
random-imdb,60b65ac40acb3a485dfa7912,2,The Thin Red Line,TRUE,1,"The film is a masterpiece of visual storytelling, with stunning cinematography and a haunting score.",Ev
random-imdb,60b65ac40acb3a485dfa7912,2,The Thin Red Line,TRUE,2,"The characters are complex and well-developed, and the film explores themes of humanity, nature, and the futility of war.",Ev
random-imdb,60b65ac40acb3a485dfa7912,2,The Thin Red Line,TRUE,3,"If you're looking for a thought-provoking and emotionally powerful film, The Thin Red Line is definitely worth your time.",Ev
gpt-3.5-turbo,60b65ac40acb3a485dfa7912,3,The Shawshank Redemption,TRUE,0,The Shawshank Redemption is a classic movie that tells the story of a man who is wrongly convicted of murder and sent to prison.,NA
gpt-3.5-turbo,60b65ac40acb3a485dfa7912,3,The Shawshank Redemption,TRUE,1,"Although it may seem like a departure from the action-packed movies that the person enjoys, The Shawshank Redemption is a must-watch for anyone who appreciates a well-crafted story with strong character development.",Ev
gpt-3.5-turbo,60b65ac40acb3a485dfa7912,3,The Shawshank Redemption,TRUE,2,"The movie is a masterclass in storytelling, with a plot that keeps you engaged from start to finish.",Ev
gpt-3.5-turbo,60b65ac40acb3a485dfa7912,3,The Shawshank Redemption,TRUE,3,"The themes of hope, friendship, and redemption are universal and will resonate with anyone who has ever faced adversity.",Ev
gpt-3.5-turbo,60b65ac40acb3a485dfa7912,3,The Shawshank Redemption,TRUE,4,"The Shawshank Redemption is a timeless classic that should be on everyone's must-watch list, regardless of their movie preferences.",Po
gpt-3.5-turbo,60b65ac40acb3a485dfa7912,4,The Notebook,FALSE,0,"Someone with the movie preferences of liking 2z Gang, Fifty Shades of Grey, Think Like a Man, and Wrong Turn, and disliking Iron Man, Taken 2, and Love at First Fight, should not watch The Notebook because it is a romantic drama movie that may not align with their taste.",Cr
gpt-3.5-turbo,60b65ac40acb3a485dfa7912,4,The Notebook,FALSE,1,The Notebook is a story about a couple's love that spans decades and is known for its emotional and heartwarming scenes.,NA
gpt-3.5-turbo,60b65ac40acb3a485dfa7912,4,The Notebook,FALSE,2,"However, based on the given preferences, the person may not enjoy the romantic genre or may prefer movies with more action or suspense.",Cr
gpt-3.5-turbo,60b65ac40acb3a485dfa7912,4,The Notebook,FALSE,3,"Therefore, it is recommended to suggest movies that align with their preferences, such as crime thrillers, action movies, or horror movies.",Pra
gpt-3.5-turbo,60b65ac40acb3a485dfa7912,5,Transformers: Age of Extinction,FALSE,0,Transformers: Age of Extinction is not worth watching because it is a poorly written and overly long movie that lacks any real substance.,Ev
gpt-3.5-turbo,60b65ac40acb3a485dfa7912,5,Transformers: Age of Extinction,FALSE,1,"The plot is convoluted and confusing, the characters are one-dimensional, and the action scenes are repetitive and uninspired.",Ev
gpt-3.5-turbo,60b65ac40acb3a485dfa7912,5,Transformers: Age of Extinction,FALSE,2,"Additionally, the movie is filled with product placements and cringe-worthy attempts at humor.",Ev
gpt-3.5-turbo,60b65ac40acb3a485dfa7912,5,Transformers: Age of Extinction,FALSE,3,"Overall, there are much better action movies out there that are more deserving of your time and attention.",Comp
random-imdb,61645edbf8a9840feeb735b6,0,Harry Potter and the Sorcerer's Stone,TRUE,0,Harry Potter and the Sorcerer's Stone is a must-watch movie for anyone who loves fantasy and adventure.,Ev
random-imdb,61645edbf8a9840feeb735b6,0,Harry Potter and the Sorcerer's Stone,TRUE,1,The movie is based on the first book of the Harry Potter series and follows the story of a young boy who discovers he is a wizard and attends a magical school.,NA
random-imdb,61645edbf8a9840feeb735b6,0,Harry Potter and the Sorcerer's Stone,TRUE,2,"The movie is filled with magic, mystery, and excitement, and the characters are lovable and relatable.",Ev
random-imdb,61645edbf8a9840feeb735b6,0,Harry Potter and the Sorcerer's Stone,TRUE,3,"The special effects are impressive, and the soundtrack is enchanting.",Ev
random-imdb,61645edbf8a9840feeb735b6,0,Harry Potter and the Sorcerer's Stone,TRUE,4,"If you enjoy movies that transport you to a different world and leave you feeling inspired, then Harry Potter and the Sorcerer's Stone is definitely worth watching.",Ev
random-imdb,61645edbf8a9840feeb735b6,1,Star Wars: Episode V - The Empire Strikes Back,TRUE,0,Star Wars: Episode V - The Empire Strikes Back is a must-watch for anyone who loves action-packed movies with a great storyline.,Ev
random-imdb,61645edbf8a9840feeb735b6,1,Star Wars: Episode V - The Empire Strikes Back,TRUE,1,"The movie has a similar vibe to Scarface, which is one of the favorite movies of the person in question.",Sim
random-imdb,61645edbf8a9840feeb735b6,1,Star Wars: Episode V - The Empire Strikes Back,TRUE,2,"The Empire Strikes Back has a great plot, amazing special effects, and a fantastic cast.",NA
random-imdb,61645edbf8a9840feeb735b6,1,Star Wars: Episode V - The Empire Strikes Back,TRUE,3,"The movie also has a darker tone, which is something that the person may appreciate, given that they disliked the Avengers movies.",Comm
random-imdb,61645edbf8a9840feeb735b6,1,Star Wars: Episode V - The Empire Strikes Back,TRUE,4,"Overall, The Empire Strikes Back is a classic movie that has stood the test of time and is definitely worth watching for anyone who loves movies with great action, a compelling storyline, and memorable characters.",Ev
gpt-3.5-turbo,61645edbf8a9840feeb735b6,2,City of God,TRUE,0,City of God is a must-watch for anyone who loves crime dramas.,Ev
gpt-3.5-turbo,61645edbf8a9840feeb735b6,2,City of God,TRUE,1,The movie is set in the slums of Rio de Janeiro and follows the lives of young gangsters as they navigate the dangerous world of drug trafficking and violence.,NA
gpt-3.5-turbo,61645edbf8a9840feeb735b6,2,City of God,TRUE,2,"The movie has a similar gritty and realistic feel to La Haine, which was one of the favorite movies mentioned.",Sim
gpt-3.5-turbo,61645edbf8a9840feeb735b6,2,City of God,TRUE,3,"Additionally, if you enjoyed Scarface, you will appreciate the intense and violent nature of City of God.",Comp
gpt-3.5-turbo,61645edbf8a9840feeb735b6,2,City of God,TRUE,4,"The movie has received critical acclaim for its direction, cinematography, and storytelling, making it a great choice for anyone who loves well-made movies.",Au
gpt-3.5-turbo,61645edbf8a9840feeb735b6,2,City of God,TRUE,5,"Even if you didn't like the Avengers movies, City of God is a completely different genre and style of filmmaking, so it's definitely worth giving it a chance.",Op
gpt-3.5-turbo,61645edbf8a9840feeb735b6,4,The Notebook,FALSE,0,"Someone with a preference for movies like La haine, The Basketball Diaries, and Scarface, and a dislike for movies like Avengers: Endgame, The Avengers, and Avengers: Infinity War, may not enjoy watching The Notebook.",Ev
gpt-3.5-turbo,61645edbf8a9840feeb735b6,4,The Notebook,FALSE,1,"The Notebook is a romantic drama film, which is quite different from the action and crime genres of the movies that this person enjoys.",Comp
gpt-3.5-turbo,61645edbf8a9840feeb735b6,4,The Notebook,FALSE,2,"Additionally, The Notebook is a slow-paced movie that focuses on the emotional relationship between the main characters, which may not be appealing to someone who prefers fast-paced and action-packed movies.",Ev
gpt-3.5-turbo,61645edbf8a9840feeb735b6,4,The Notebook,FALSE,3,"Therefore, it is unlikely that someone with these movie preferences would enjoy watching The Notebook.",Ev
gpt-3.5-turbo,61645edbf8a9840feeb735b6,5,Twilight,FALSE,0,Twilight is a movie that may not be suitable for everyone.,NA
gpt-3.5-turbo,61645edbf8a9840feeb735b6,5,Twilight,FALSE,1,The movie is based on a popular book series and follows a teenage girl who falls in love with a vampire.,NA
gpt-3.5-turbo,61645edbf8a9840feeb735b6,5,Twilight,FALSE,2,"The movie has been criticized for its weak plot, poor acting, and lack of character development.",Ev
gpt-3.5-turbo,61645edbf8a9840feeb735b6,5,Twilight,FALSE,3,"Additionally, the movie promotes unhealthy relationship dynamics and sends a problematic message to young viewers.",Ev
gpt-3.5-turbo,61645edbf8a9840feeb735b6,5,Twilight,FALSE,4,"Overall, if you are looking for a well-written and thought-provoking movie, Twilight may not be the best choice.",Cr
gpt-3.5-turbo,5ff797b72ac13349beac1906,0,The Dark Knight,TRUE,0,The Dark Knight is a must-watch for anyone who loves action-packed movies with a gripping storyline.,Ev
gpt-3.5-turbo,5ff797b72ac13349beac1906,0,The Dark Knight,TRUE,1,"It has a complex plot that keeps you on the edge of your seat, and the performances by the cast are top-notch.",Ev
gpt-3.5-turbo,5ff797b72ac13349beac1906,0,The Dark Knight,TRUE,2,"If you enjoyed Inception, you'll appreciate the intricate plot of The Dark Knight.",Sim
gpt-3.5-turbo,5ff797b72ac13349beac1906,0,The Dark Knight,TRUE,3,"The movie also has a dark and gritty tone, which is similar to Forrest Gump's serious moments.",Sim
gpt-3.5-turbo,5ff797b72ac13349beac1906,0,The Dark Knight,TRUE,4,"On the other hand, if you disliked Death Note and The Purge: Anarchy, you'll appreciate that The Dark Knight doesn't rely on cheap jump scares or gore to create tension.",Op
gpt-3.5-turbo,5ff797b72ac13349beac1906,0,The Dark Knight,TRUE,5,"Overall, The Dark Knight is a well-crafted movie that will keep you engaged from start to finish.",Ev
